{
  "defaults": {
    "max_total_bytes": 2000000000,
    "naip_resolution_meters": 1.2,
    "portion": "overview",
    "preview_width": 3840,
    "service_tile_size": 1200
  },
  "inspection_focus": [
    "vegetation response by crop class",
    "CDL boundary alignment",
    "shared extent and pixel frame",
    "categorical class preservation"
  ],
  "maximum_naip_pixel_size_m": 1.5,
  "preview": "ndvi_cdl_boundaries",
  "purpose": "Compare NAIP vegetation response with USDA CDL crop identity and class boundaries.",
  "recipe_id": "crop_vigor_classification",
  "required_assets": [
    "natural",
    "ndvi",
    "cdl_classes"
  ],
  "required_output_artifacts": [
    "asset_plan.json",
    "recipe_receipt.json",
    "class_inventory.csv",
    "preview_4k_png",
    "checksums.sha256"
  ],
  "resampling": {
    "categorical": "nearest",
    "imagery": "cubic"
  },
  "schema_version": 2,
  "title": "Crop Vigor \u00d7 CDL Classification"
}
