{
  "defaults": {
    "max_total_bytes": 2000000000,
    "naip_resolution_meters": 1.5,
    "portion": "overview",
    "preview_width": 3840,
    "service_tile_size": 1200
  },
  "inspection_focus": [
    "dominant CDL classes",
    "class pixel counts",
    "approximate hectares",
    "cropland and noncropland composition"
  ],
  "maximum_naip_pixel_size_m": 1.5,
  "preview": "class_inventory",
  "purpose": "Inventory USDA CDL classes and approximate class area with imagery and NDVI context.",
  "recipe_id": "crop_class_area_inventory",
  "required_assets": [
    "natural",
    "ndvi",
    "cdl_classes"
  ],
  "required_output_artifacts": [
    "asset_plan.json",
    "recipe_receipt.json",
    "class_inventory.csv",
    "preview_4k_png",
    "checksums.sha256"
  ],
  "resampling": {
    "categorical": "nearest",
    "imagery": "cubic"
  },
  "schema_version": 2,
  "title": "Crop-Class Area Inventory"
}
